date,user,star,like,comment
2019년 3월 26일,황태원,1,,저는좀 이게 pc 버전이 있으면 합니다 휴대폰 사용이 많은뎅 여기에 멀티로 띄어놓는것보다 pc 버전도 잇어서 노트북으로 좀더 큰 화면으로 보고 그랬으면 좋겠네요
2019년 1월 28일,Google 사용자,1,28.0,이거 빅스비나 설정 들어가려 하면 SmartThings 앱이 중지되었습니다. 경고창 뜨면서 핸드폰이 2-3초 순간 먹통이 됩니다.. 이유가 뭔가요?
2019년 1월 29일,브론즈의일상,4,,약간 뭐라고 해야할지 오프라인이라고 뜨길래 문제 상황을 봤는데 다 아니더라고요 그래서 아예 로그아웃 했다 다시 하니깐 되더라고요 그러니깐 이런건 좀 보안해주시길 바랍니다
2021년 4월 24일,Heekyung lee,3,1.0,어제까지 에어컨이랑잘연결되다가 갑자기 핸드폰이랑연결이안됨 전원기기코드확인하라고해서 뺐다껴도안됨 자꾸오프라인으로표시됨..별짓을해도안됨
2021년 4월 27일,Junmo Koo,5,,앱 덕분에 삼성제품을 좀더 효율적으로 쓸 수 있게 되었습니다. 가정에서 삼성 제품을 쓰고 있다면 무조건 사용하시길 강추합니다
2020년 6월 9일,ᄋᄋᄋᄋ,1,1.0,에어드레서 구매후 연결하려고 하는데 44%에서 자꾸 멈춥니다. 이걸 오류보내기로 보내려고 하는데 그것마저 에러가 나네요
2020년 6월 15일,청년재벌,3,,지도보기 화면에서 아래 정보윈도우 좀 내릴수있게 해주세요 제발 지도가 절반만 보이니까 불편합니다 별로 중요한 내용도 아닌데 왜 못내리게 돼있는지 모르겠습니다
2019년 5월 13일,니리니익,2,,자동화가 단순히 켜고 끄는 것 말고 동작했다가 특정 조건이 충족되면 트리거 작동되는 것을 하나의 자동화에 넣을 수 있어야
2019년 5월 13일,Yeon-e Kim,5,17.0,"집 밖에 있을 때도 공기청정기를 제어할 수 있고, 필터 소모량과 실시간 집안 미세먼지를 확인 할 수 있어요. 바깥 공기가 좋지 않을 때 자동으로 켜지게 할 수도 있고 참 좋네요. 이 어플을 통해야 비로소 가전제품을 완전하게 소유할 수 있기 때문에 적극 추천합니다."
2020년 8월 10일,Tim Park,1,1.0,업데이트 후 앱 실행시 기기들이 정상으로 안뜨네요. 빨리 오류 수정해주세요. 원격이 안됩니다.
2019년 7월 20일,이남주,5,1.0,너무 빠르고 기능도 많고 좋습니다. 하지만 아직 모든 기능을 다사용 하진 않았어요. 스마트싱스의 기능은 매우 무궁무진한것 같아요.^^
2019년 7월 23일,박등현,5,,현재 편리하게 사용중
2019년 3월 7일,모리스,1,1.0,매번 오프라인 이라고 하는대 오류가 너무많아요 티비 에러 김치냉장고 에러 에어컨.냉장고.스타일러는 잘됨 왜 오류가 이리많은가요 ㅡㅜ
2021년 2월 27일,이정은,5,,"안녕하세요. 집에 있는 아이 때문에 그런데, 티비 시청 제한 시간이라든가, 제한 비밀번호 설정등을 안되나요? 절박합니다. 꼭 도와주세요."
2021년 3월 3일,ggobong Lee,5,,전기세 절약에 좋고 방에서 거실 공기청정기 끌수있어 편해요 빨래 다되면 알려주고 냉장고문 잘 안닫혀도 바로 알수 있어요~ 에어드레서나 세탁기 핸드폰으로 메뉴설정하기 좋아요
2019년 12월 21일,Jihyun Kim,5,,"핸폰 삼성 쓰는데 결혼할때 우연히 모든 가전제품이 삼성이 되었어요. 이 어플 기능중 에어컨 사용이 젤 짱이에요. 더운날 집에 들어가기 10분전, 에어컨이랑 공기청정기 미리 가동시켜 놓으면 진짜 쾌적. 완전 추천"
2020년 1월 3일,소망의삶,2,,잘되다가 하루지나면 기기가 오프라인이라고 뜨는데 매일 새로 등록해야하나요? 어플문제인지 에어컨문제인지 영 찝찝하네요
2019년 7월 29일,혜린유튭,1,,최신업데이트 이후 무풍에어컨 연결이 오프라인으로 연결이안됨 삼성에문의하니 역시나 매크로 답변 앱 업데이트를 해주시던지 구버전 다운받을수있게 새주세요
2019년 8월 19일,횬킴,1,,아ㅡㅡ 열받네요 뫠 갑자기 잘되다가 어제부터 안됩니까? 진짜 개짜증나네요
2019년 6월 6일,명곤김,3,,잘 사용중인데 ... 초기 연결이 자꾸 오류가 납니다ㅠ 그거랑 모델 작동시 인터넷 삼상 계정 연결은 왜 계속 뜨는거죠? ? 이것 좀 없애주세요
2019년 6월 7일,김대욱,4,,정말...삼성입니다 너무 편해요
2020년 7월 29일,Seong2,2,,공기청정기 추가하는데 39%에서 계속적으로 중지돼요. 어플 몇번을 지웠다 다시 깔아봐도 그러네요... 도대체 어떻게 써야하는건지...
2020년 7월 30일,Mikyoung Lee,1,1.0,갑자기 먹통이네요 모델명보고 다시 설치했는데 벽걸이는 제어가 안되네요 ㅡㅡ.. 어떻게 사용하나요 리모컨도 잃어버렸는데
2019년 9월 10일,Jung Hoon Jang,4,1.0,에어드레서 사용중인데 스페셜코스 다운받아서 추가기능 사용하고싶은데 다운이 되지않고 서버로부터 데이터 받아오는중이니 잠시후 다시 시도하라고 나오는데 어떻게해야하나요? 한달째 계속 이럽니다...
2019년 9월 11일,hl kim,5,1.0,uhd tv에 연결해서 노트8로 티브를 자주보는데 갑자기 티브보기메뉴가 없어지고 스마트뷰하고 소리로듣기메뉴만있네요 이제 티브보기 안되나요?
2019년 9월 5일,Google 사용자,5,1.0,저 한번 댓글을 썻는데 이번에 질문하나 드리겠습니다. 제가 집에들어 오면 공기청정기가 켜저야되는데 안켜지는게 반복되서 다 확인 해봤는데 멀쩡하거든요. 계속 오프라인 이라고 떠요. 어떻게 해야 되죠?
2019년 9월 6일,전성국,5,,잘쓰고있어요~ 폰 두대 사용중인데 두대모두 잘 되네요~^^ 한대에 제품 모두 등록하고 구성원에 나머지 폰 계정등록해주니 둘다 사용 가능해요~^^ 삼성계정 두개당연 필요하구요 ㅎㅎ
2020년 12월 20일,jei jei,5,,집안에서도 밖에서도 곳곳의 기기 제어가 가능. 기본작동 외 집안 컨디션에 관한 세부 정보까지 보여줘서 똑똑한 집사를 둔 느낌! 스마트시대를 체감하네요
2020년 10월 26일,EH,1,1.0,어제부터 이어플에서 에어컨이 오프라인으려뜨고 에어컨 삭제후 다시 연결하거나 어플을 삭제후 다시 해봐도 어플에서는 오프라인으로만 뜹니다
2020년 10월 30일,Google 사용자,1,,디바이스 연결도 잘 안되고 도면 그리기도 넓은 집은 구석구석 빠지는 곳도 있고.. 구역별로 청소시키려면 어떻게 해야?
2020년 6월 12일,이진영,4,,예전에 스마트홈 앱은 여러명이 사용 가능했는데.. 스마트띵스 앱은 사용자 추가 등록이 안되는듯 해요;;
2020년 6월 15일,In Cheul Choi,5,1.0,이퀄라이져 더 추가해주세요 아쿠아 음향으로 아예듣고싶을때가 있었답니다. 항상귀에 꼽고있으니 노래라기보다 음처럼 듣고 싶은 맘이 있쏘용
2019년 8월 14일,Check Munk,1,,이 앱을 지우면 핸드폰 사용이 불가능 할정도로 '퀵 커넥트가 중지되었습니다.' 메시지가 빈번하게 발생됩니다.
2020년 6월 10일,SangUk Kim,3,13.0,갤럭시 태그의 위치정보가 제대로 표시되지 않습니다. 아무리 갱신을 해도 스마트폰 위치를 계속 따라옵니다. 태그가 한번도 온적 없는 위치인데도 스마트폰만 계속 따라오네요
2020년 6월 15일,이혜림,1,,혹시 제가 엘지폰이라서 안되는건가요!? 예전 삼성계정으로 로그인하고 그뒤로 안넘어가는데... 폰을 삼성으로 바꾸라는건지.....
2019년 4월 22일,나동욱,4,,"자동화 설정시 일몰-일출 만 설정가능한데, 일몰-23시 또는 02시-일출 이렇게도 설정 가능하면 좋겠습니다. 변경되면 저도 앱 평가를 별5개로 바꿀께요"
2021년 4월 21일,조보연,5,,편리합니다^^ 세탁기의 경우 와이파이가 한번 연결되면 다음 번에도 설정을 기억하여 자동 연결되면 더 편리할것 같아요~^^
2021년 4월 21일,LEA YIM,2,3.0,안드로이드 11로 업뎃후 상단 알림창에서 사라졌어요 한번더 위에서 아래로 끌어내려서 전체화면을 만들어야지 디바이스라고 나타나요 .....왜자꾸 숨겨져요 ㅠㅠ 상단알림창 드래그해서 작은화면으로 나타날때 바로 스마트띵스 아이콘보이게 해주세요 !!!
2019년 9월 26일,Luxury SEO,5,1.0,삼성 스마트씽스 유플러스와 협업 요청 합니다 유플러스iot home 어플에서 삼성가전등록하는 부분이 있는데 기존에 사용하던 삼성smathome이 4월자로 없어진다는 공지가 있던데 이에따라 어플연동이 되지않습니다 유플러스에 요청하여 삼성스마트씽스와 연동할수 있게 어플을 개선해 달라 했더니 삼성측에 문의해보라는데 이건 어느부서담당인가요? 유플러스에 삼성스마트씽스라는 신규어플에 대한 연동 가능하게 유관부서의 협업 요청드립니다
2019년 9월 30일,요나,4,,사용하기 너무 쉽고 간편해서 유용하게 사용하고 있으나 처음 실행시 리딩 시간이 가끔 길어지기도 하는것이 조금..
2019년 12월 27일,이승희,1,,공기청정기는 연결이 끊기고 티비는 컨트롤러 다운받아라고하면서 다운은 안되고 에어컨은 아직 사용을 안하니 모르겠고 왜 갑자기 안되나요?????
2019년 12월 30일,이재하,2,,업데이트이 후 앱충돌이 발생한다고 디바이스케어에 뜨더라구요.. 삼성멤버스에 물어보니 각 앱담당자들에게 물어봐야된다고 하더라구요..ㅠ
2020년 2월 13일,Yeon-Jung Jeong,3,1.0,이거 삼성티비와 연결해서 폰화면에서 티비보는 기능이 없어졌네요. 이제는 영상은 안되고 음성만 재생되네요
2020년 2월 13일,young ke,5,,편리하고 좋아요. 휴대폰영상 tv로 전송해서 보다가 끊을때 tv리모콘이 먹통이 되는데 왜그런지를 모르겠네요
2020년 8월 8일,조길성,1,,무풍스탠드 에어컨 등록할려고 하는데요. 리모컨 AP모드됬는데 에어컨은 아무런 반응이 없고 핸드폰도 디바이스 검색안되네요....
2020년 8월 11일,Hyunus,5,,공기청정기 사용중인데 제품 조종 화면도 다크모드로 안되나요? 다크모드였다가 공기청정기 조종 화면은 흰화면이라서 폰화면이 조금 부담스러워요...
2021년 6월 26일,유지순,3,,세탁기는 스마트싱스에서 지원하는 기능이 뭔가요? 핸드폰에서 조작할수있는데 하나도없는데.. 세탁완료 알람 받기 기능만 있는건지.. 궁금합니다
2021년 8월 8일,반짝반짝,5,,"로봇청소기 사용으로 다이슨을 거의 안쓰게 되네요 2년전 제품인데도 신세계를 경험하게 되었어요 다만, 아쉬운 점이라고는 움직인 궤적을 가상 맵으로 볼 수 없다는 점 하나 빼곤 구석구석 나름 꼼꼼하게 해주네요"
2021년 8월 9일,Seung Hwa Shin,5,,예약 및 설정이 간편하여 리모컨보다 이 앱을 자주 사용합니다 다만 예약 켜짐 설정시 무풍 기능을 추가해주시면 좋겠습니다
2019년 7월 31일,김꾸,4,1.0,좀더 연결된 기기에 디테일한 컨트롤이 가능해야 실용성이늘어날듯합니다 샤오미 등은 아무리 낮게 밝기를 지정해도 샤오미어플에서 한 50프로 정도 밝기정도까지만 낮아지네요
2019년 8월 1일,스마일,5,,삼성 제품을 손쉽게 컨트롤할수있으니까 너무편하고 좋네요
2019년 7월 22일,이경애,5,3.0,올여름에도 또한 잘 사용하고있어요. 이전보다 더더 디테일해져서 설정하기도 쉽고 보기에도 좋고 전력 사용량도 시간대별로 알려주고..
2019년 7월 23일,YJ Kim,5,,아이들 위치 확인용 스마트 태그 사용하는데. 좋아요~ 배터리 사용량도 확인되고 필요할때 한번 더 체크도 되고요^^
2021년 4월 2일,yongje kim,1,,기기연결 할수가없음 잘 썻었는데 몇일전부터 갑자기 이럼
2021년 4월 8일,Rich Rich,4,,처음엔 연결이 안되다가 그담날 회사에서 연결이 되네요. 불편한점은 스마트씽스 맨첨 화면에서 한번에 제어창 연결되면 좋겠는데 뎁스가 좀 있는게 불편하네요.
2020년 4월 19일,과밀,1,,삭제가 안되요 삭제 버튼이 앖어요 인터넷 와이파이는 5기가인데 2.45기가에 연결하레요 5년전에 산 40만원짜리 보일러도 두 주파수를 모두 지원하는데
2020년 4월 20일,솔이집사,2,,연결하기 힘듭니다. 삼성에어컨을 삼성이 만든 앱으로 삼성이 만든 폰으로 연결이 안 되고 애플이 만든 폰으로는 연결이 됩니다. 연결이 된 이 후에야 삼성폰에도 연결된 것으로 나오네요..
2021년 8월 31일,min,1,,"공기청정기 어플에서넘어오래서 넘어왔더니 공기청정기 항목이 있지도 않고., 준비를 제대로 해두고 앱 스위칭이 되게 해야하는게 상식아닌지"
2021년 5월 14일,sowon LEE,1,,공기청정기 연결이 아무리해도안돼요. 와이파이 연결되어있고 AP표시도뜨는데 안되구요 모델을 찾아서입력해도 안돼요
2020년 6월 12일,박상현,1,,업데이트되고나서 기능이 오히려 축소됨 그전에는 티비연결이 됐는데 이젠 연결이 안됨 삼성이 아닌것은 연결이 더어렵게 해놓는구나...ㅡㅡ
2019년 7월 30일,자두,1,6.0,더프레임 tv에 사진 추가 하려는데 한장짜리 사진 저장은 가능하고 두개이상 해서 콜라주로 올리려면 사진은 안보이고 레이아웃만 보입니다. 갑자기 이런 현상이 나타나네요
2019년 7월 31일,김송미,5,,에어컨 티비 등 리모컨없이도 컨트롤하기 너무 좋아요 덕분에 삼성가전만 사게되네요 아쉽다면 선풍기등 소형가전도 포함되면좋겠습니다
2019년 11월 11일,scynada,1,,공기청정기 사용중인데 공기청정기를 작동할까요? 라는 알람이 너무 자주 옴. 1시간에 7번 이상 알림이 온 듯. 한번 거부했으면 몇시간 정도는 알리지 마요 좀. p.s 알림 뜨는거 확인해보니 5분간격으로 알리네. 적당히좀 합시다.
2019년 4월 13일,조성순,5,4.0,네 저는 유튜브가 넘 좋았어요 그래서 애독 할수 있는 사항은 좋아요로 찍고 구독 하면 되는 구나 잘모랐거든요! 가끔 좋아요 선택 하고 약간의 pay도 하기도 했어요 .그런데 얼마나 정보들이 좋아 어떤때는 졸면서도 구독하다가 졸다가 하는 때도 있었어요 유튜브 정보는 제가 알기로 모든 정보중 최고 였어요 .배울것도 많았고요 그런데 1년구독 하고 싶어요 .
2019년 8월 24일,jong woong yoem,5,4.0,아주 잘쓰고 있습니다 감사합니다 그런데 노트8 쓰다가 노트 10으로 변경했는데 노트8에서 사용하던 상단바의 상태바가 10에서는 안되네요 ㅠㅠ 잘 썼는데 혹시 지원 예정 있으신가요?
2019년 8월 26일,박은희,5,,"너무 만족합니다.. 밖에서도 공기질 상태 알려줘서 공기청정기 껐다가 켰다 할 수 있고, 냉장고 온도 및 티비.에어컨 다 볼 수있어 좋아요.."
2020년 8월 22일,love song,1,,윗분처럼 싱스깔고 추가하기 안되길래 직접 추가하기 했는데도 와이파이 끊기면서 계속 시도만 하고 안되네요. 연결이 되야 뭘 해먹지..
2020년 8월 28일,가챠흙,5,,특정 시간단위로 켜고 끌 수 있게 하는게 있었으면 좋겠어요 10분단위로 켜고 끌 설정 하려니 너무 많이 설정해야하네요 다양하게 적용 가능할거같습니다. 시간 설정에 매시간이라는 설정을 넣어주세요
2020년 8월 13일,루이,1,,예전엔등록해서잘이용했던기기(VR20J9250UK)가 이젠지원되지않는기기라연결이안된다함...왜이러지?
2020년 8월 28일,노승현,1,,TV 연결하려는데 리모컨으로 설정 누르나는데 도대체 어떻게 하라는 건지 전혀 모르겠네 리모컨을 아무리 눌러도 다른 것만 나오고 어쩌라는 거야
2020년 12월 6일,생당근,2,,버즈 플러스로 유튜브 라이브 보는중에 소리가 1-2초정도 새어나와서 깜짝 놀랐어요. 기종은 노트20입니다.
2019년 4월 23일,율둥이하우스,5,2.0,출산한지 얼마안되서 아기를 케어하다보면리모컨을 집어오지 못하는경우가 많은데 너무 실용적입니다.요즘 통신사에서 강요하는 lot도 안해도 되고👍🏻진짜편하네요
2019년 4월 23일,배은정,1,,AF16M7574WV 에어컨사용중입니다 작년여름까지만해도 어플을 이용해서 밖에서도 에어컨 컨트롤 할 수 있어 좋았는데 갑자기 에어컨을 찾지도 못하고 연결자체가 안되네요 와이파이도 삭제해보고 폰이며 에어컨도 껐다켰는데도 안되고 해결부탁드립니다
2019년 3월 17일,구너정욱,4,1.0,"개선 제안 드립니다. TV 사용시 리모컨 기능에 ""키보드"" 를 넣으면 완벽 자체 입니다. 보고있나 담당자들!"
2019년 3월 18일,HYOUNG CHUL BAE,4,,30분 간격으로 설정하면 배터리가 이틀마다 충전해야 해요. 위치는 러프하지만 대부분 잘 맞게 표시해줍니다.
2020년 8월 16일,공포의쓴맛,3,6.0,자동화에서 보일러 사용시 전원 켜짐 꺼짐은 작동이 잘되나 온도 조절이 안됩니다. 전원 켜짐 꺼짐이 필수 선택 사항인데 전원 옵션 실행되면서 딜레이 걸리는거 아닌가요? 전원 옵션 선택안하고 온도 조절만 가능하게 해주시면 좋겠습니다.
2019년 7월 20일,Jeong Gon Son,5,8.0,"스마트싱스 앱의 파인드 잘 쓰고 있습니다. 그런데, 집에 타이젠 4.0 기반인 기어스포츠와 워치액티브1이 있는데, 이 제품에 대한 지원은 현재 이루어지고 있지 않은데, 지원이 이루어지는지, 이루어진다면 언제쯤 이루어지는 알고 싶습니다"
2019년 7월 23일,Head Y,1,,연동되는 제품도 적구 왜 제한을 둔건지 모르겠음 각종 iot기기를 구매해도 연동되는게 없으니 사용을 못합니다 그러면서 폰에는 자동으로 설치되어있으니
2019년 10월 17일,ᄏ일등급머스마,1,,이건뭐 사용하라는건지 보여주기식인가요 노트9사용중인데 식세기 냉장고 김치냉장고 세탁기 건조기 시스템에어컨 등 점부삼성건대 다등록하라고는 뜨는데 공간설정에 거실에서 바꾸려해도 폰에뒤로가기버튼이랑 겹쳐서 설정할수도 없고 앱을 실행시켜도 가서 시작버튼 눌려야되고 뭔짓인지 모르겠네요
2019년 10월 17일,편현준,5,8.0,신혼집에 에어콘 두대 세탁기 건조기 QLED티비 냉장고 전부 등록해서 엄청 편하게쓰고있어요 전기료는 거의 비슷하게 나와서 오차범위내라 에너지모니터링 기능 너무 잘쓰고있어요. 미리 예약해놓으면 시간대에 자동으로 작동되니 엄청 편해요.
2020년 4월 2일,Master Piece,1,4.0,이번 업데이트 후로 잘연결되던 TV검색이 안됩니다.. 이럴거면 뭐하러 업데이트 하나요. 짜증나서 다른 앱 찾아야겠네요
2020년 4월 3일,주연한,1,,밖에서는 아예 집안기기컨트롤을못하는건가요?집안에서 기기접속 동일와이파이 접속시에만되나요? 그런거라면무슨의미가있는지..
2021년 1월 9일,박진아,5,1.0,전부 앱 하나로 컨트롤할 수 있어서 좋은데 왜 스마트띵즈 컨트롤을 하려면 세탁기랑 건조기 문을 전부 닫아야하나요? 그거랑 스마트띵즈가 켜져있는 상태에서 세탁이나 건조가 끝나도 문이 락되어 있어서 불편해요
2019년 1월 20일,써벨로,3,,"스마트띵즈 다 좋은데, 냉장고내용물 기한 정리한게 왜 공유가 안되지요? 집사람이 입력한 걸 같은 기기 공유하는 사람은 볼 수 있으면 편리할 텐데요"
2019년 1월 22일,신기승,1,2.0,"안드로이드 업뎃하니까 무슨 미디어디바이스 이렇게떠서 굳이 디바이스를또 눌러서 스마트띵스 조작해야되게 바뀌었네요, 예전처럼 바로 사용할수잇는방법 알려주세요"
2020년 2월 29일,정승아,5,,솔직히 뭐하는 앱인지는 잘 모르겠지만 좋아요
2020년 3월 2일,JaeHyung Lee,5,,삼성티비 리모컨 전원버튼 간혹먹통되서 거지같이 베터리 분리후다시 끼워야 작동하는대 이앱으로 종료할수있어서 거지같은 리모콘 치워버렸내요 리모콘좀 잘만드시고 어플은 좋습니다
2021년 5월 3일,김유경,1,3.0,별점 하나도 아깝네요 WF21N8750TV 스마트컨트롤을켰는데도 안돼서 리뷰에는 자세한 답변이 있을까싶어 확인해봤는데 별다를것없는 똑같은 답변에 실망이네요 사용설명서 컴으로 다운받아서 53p 부가기능선택부에 스마트체크기능표시보고 혹시나해서 누르고 스마트컨트롤버튼 누르니 바로 인식돼네요.. 이방법이 그냥 어쩌다 된걸수있겠지만 같은모델이신분들 혹시나하는 생각으로 해보시길바랍니다 제품은 진화하고 변화하는데 그에대한 기본적 준비는 변화가없다고 느꼇어요
2021년 5월 7일,valuer Park,5,,tv리모컨 ui를 개선해서 각종 어플에서 검색시 쿼티나 천지인 자판을 바로 사용 할 수 있게 해주세요. 부탁드립니다.
2020년 3월 3일,Gyeon In,1,1.0,옵션박스 체크 박스 구분못하세요?? 퀵슬롯에서 미디어 가서 보면 그게 옵션박스에요 체크박스가아니고 옵션이 하나만 선택가능하지만 체크는 여러가지 산택가능했다고요 처음버전에는 체크박스였데 옵션박스로 바꾸어놨다구요 프로그램 하시면 기본알아야할 내용인데 .....쩝 잘 보시고 고쳐주세요
2020년 3월 4일,알툴바,1,,갑자기 내가 이번달 사용한 전력량이 만 키로와트시가 나온다고 뜸... 가정집에서 모든 제품을 풀로돌려도 이렇게 안나오지않음? 말이안된다는걸 알면서도 개찝찝함 이거 왜이럼?
2020년 3월 16일,오향미,2,1.0,왜 휴대전화로 소리듣기는 어떨때는 있다가 다음날은 없다가 왜있다가없다가 사라지는건가요ㅠ그게젤필요한건데 제휴대폰만그런건가요ㅠ
2020년 8월 25일,강은구,3,,갤럭시j4+ 모델사용중인데 스마트미러링기능이 왜 없나요? j7 s9에서는 잘됩니다 확인해서 j4+ 에도 미러링넣어주세요 리모컨기능은 잘됩니다
2020년 9월 1일,파송송,2,3.0,SmartThings energy에서 시간별 사용 그래프가 처음한번에는 정상적으로 크게 보이는데 시간을 이동하면 좌측 상단에 조그만하게 표시되서 보기 힘듭니다. 수정해주세요. 그리고 느려요. 느려야할 이유가 없을텐데 느린거보면 매번 냉장고랑 접속을 시도하는거 같은데요? 개발하신분은 조속히 확인후 개선해주세요. 2020.09.01 안내해준 방법으로 오류보내기 완료
2020년 7월 12일,난나다,5,,저는 공기청정기를 사용하지만 이 기능으로 인해서 전자제품 구매할때 기능이 가능한지 보고 살꺼같아요 너무 편해요
2020년 8월 14일,다현튜브채널,5,,폰으로 집안 가전을 컨트롤 할 수 있어서 리모컨을 찾지 않아도 되고 집에 오기전 에어컨을 틀어 놓는 등 매우 유용합니다
2020년 8월 25일,YJ Park,1,2.0,갤럭시S9 사용중인데 업데이트 전엔 스크린미러링이 됐는데 지금은 안됨. 넷플릭스 스마트미러링으로 시청했었는데 안되니 짜증남.
2018년 10월 17일,김성진,3,,블루투스 이용중일때 스피커와 이어폰을 쉽게 바꿀 수 있게 상태창에 음향기기한정 등록기기를 보여줄수있게 하거나 설정가능하도록해주세요
2018년 10월 17일,엄친아 [엄청친절한아재],4,,알림창에서 바로 아이콘으로 스마트띵스로 들어가는 기능이 사라졌습니다.. 엄청 편리했는데 어떻게 다시 쓸수있을까요??
2018년 12월 9일,**파파캠퍼,1,,"최악이다 스트레스 엄청받네 ~~~구글미니,샤오미 같은 제품은 너무 쉽고 잘 연결되는데,,,완전 쓰레기 ~~~~"
2018년 12월 17일,김재영,1,2.0,진짜 별 하나도 아까움. 소프트웨어 업데이트하면 작동유무확인안하는건가요.. 업데이트이후 공기쳥정기 원격작동안됨
2021년 8월 5일,ok jade,2,,아씨8 에어컨 잘 되던거 뭔 업데이트 하더니 하나도 안되고.. 앱지웠다 재설치는 되지도 않고.. 샤오미보다 못하냐? 짱나네.
2020년 6월 10일,DON K,4,,가전 제품의 상태를 한 눈에 볼 수 있어 편리합니다. 일부 가전은 전원을 끄면 대기상태로 들어가지 않고 wifi 연결이 끊어지네요.
2020년 6월 15일,mh Jeong,5,,"쇼파나 침대에 앉아서 편리하게 공기청정기를 켜고 끄고, 식턱에 앉아서 에어컨을 컨트롤하고 전력사용량, 공기질 측정도 됩니다."
2020년 6월 30일,MJ Choi,1,1.0,기본이 규칙 실행아닌가? 노크9으로 한달 사용해본 결과 실행 성공률 6%. ㅋㅋ 한달간 딱 두번 동작하네. 이러고는 스마트는 무슨 ㅋㅋ 아직 멀었네~
